id_imagen,id_seqq,descr
2706766641_a9df81969d.jpg,0,A child and floor covered in white powder
2709683703_5385ea9ef4.jpg,0,A man is squirting water into a white dog 's mouth with a squirt gun
2710280476_dcccb8745a.jpg,0,A black and white dog leaping through the air as two people watch in the background
2713897716_c8cd610360.jpg,0,A black and white dog is playing with a ball that has a tear in it
2714220101_c31db50b10.jpg,0,A little white dog running through the sand
271660510_dd4ba34b35.jpg,0,A man and a woman in white shirts and dark glasses smiling
2717686269_80c4b5ac9e.jpg,0,A brown and white dog relaxes on a carpet in sunlight
2719102611_fef453bf30.jpg,0,A man in a black and white uniform stands on a motorbike doing a stunt
272283076_2d4aa1d5cf.jpg,0,a man in a white shirt is climbing a wall while another man watches
2724485630_7d2452df00.jpg,0,Two blonde women are wearing white I love beer shirts
2730994020_64ac1d18be.jpg,0,A black and white dog is running in the grass
2732625904_4fbb653434.jpg,0,A girl in a pink dress rides her bike along a white picket fence
2735158990_56ff6bf9b0.jpg,0,A brown and white dog stands on his hind leg and barks
2735979477_eef7c680f9.jpg,0,A tan dog and larger white dog run along the grass
274313927_404d0e94ab.jpg,0,A black dog standing in some grass holding a white plastic item in its mouth
2744600462_5804577296.jpg,0,A cyclist donning blue and white is leading a pack of cyclists
2752084369_52e7867da7.jpg,0,A little girl in a red dress and white hat holding two ZARA blue bags
275401000_8829250eb3.jpg,0,"A brown , tan , and white dog and a black and white dog are playing with a tennis ball on a house deck"
275516348_cbccebc125.jpg,0,a brown and white dog jumping on a sandy beach
2759211664_d21393b668.jpg,0,A boy in a red shirt and white shorts is standing in the sand
2764732789_1392e962d0.jpg,0,"A brown and white dog wearing a red harness is running through a dry field , ears flapping"
2768021570_46bc6325e3.jpg,0,A black and white dog is staring at two brown lambs
2774430374_fee1d793e7.jpg,0,"A little boy holds a bat waiting for the pitch on a tiled outdoor area wearing a red shirt , white shorts , and blue flip flops that are too big for him"
2775249812_f4db95e818.jpg,0,A girl in a white coat stands in the middle of a fountain and a boy in the background laughs
2785115802_137fa30000.jpg,0,A black and white dog is swimming
2787276494_82703f570a.jpg,0,A little boy in green goggles and a white life jacket jumps into the water
2789688929_9424fceed1.jpg,0,Two elderly females sitting on a white bench amongst trees
2792409624_2731b1072c.jpg,0,A black and white dog is drooling whilst walking on the grass
280706862_14c30d734a.jpg,0,"A black dog emerges from the water onto the sand , holding a white object in its mouth"
2808098783_c56b44befa.jpg,0,A brown and white dog is licking a dog that looks very similar
280932151_ae14a67be5.jpg,0,A white dog running from a wooded area
2813033949_e19fa08805.jpg,0,A black and white dog jumping for a ball
2813784259_d201044d71.jpg,0,A boy wearing a white headband is kicking a soccer ball down the field
2822148499_eaa46c99d4.jpg,0,A brown and white dog is looking at a tennis ball floating in a pool
2822290399_97c809d43b.jpg,0,A small white dog has on a leash and is walking next to a fence
2823075967_be4c350e9e.jpg,0,A black and white dog is playing with a tan dog
2831723637_30d4456665.jpg,0,A brown and white dog is running around a pole
2832487464_2d30634e1e.jpg,0,A black and white dog is jumping over a hurdle
2833560457_24aedf3bef.jpg,0,A beige and white dog is running quickly across the grass
2836864045_9a093cfd65.jpg,0,A black and white dog carries a white Frisbee over the grass
2839038702_e168128665.jpg,0,a black and white dog with a stick in his mouth standing on a hill
2839532455_36a7dc4758.jpg,0,"A black , white , and brown dog is playing with a green and pink ball on sand"
2839789830_89668775a4.jpg,0,A black and white dog catches a Frisbee on a grassy field
2839807428_efe42423f2.jpg,0,A collie catches a white Frisbee at an obedience competition
284441196_8ebb216d0d.jpg,0,A brown and white dog runs across the grass
2844641033_dab3715a99.jpg,0,A black boy in orange and white trucks on playing in the sand
2848266893_9693c66275.jpg,0,A man in a white suit walks down the street holding a newspaper
2851931813_eaf8ed7be3.jpg,0,A baby girl in a white shirt and jeans sits on the grass by the street
2853205396_4fbe8d7a73.jpg,0,A black and white dog is jumping into the water
2853743795_e90ebc669d.jpg,0,A black and white dog jumping over a red and white bar
2853811730_fbb8ab0878.jpg,0,A man in a white shirt is standing in a tent holding a banjo or guitar
2855695119_4342aae0a3.jpg,0,A brown and white dog goes into water while looking back
2855910826_d075845288.jpg,0,A football player in a blue and yellow uniform is tackling another player in a white and gold uniform
2856456013_335297f587.jpg,0,A soccer player in a white shirt moves to run past a player from the opposite team
2860202109_97b2b22652.jpg,0,A black man is wearing sunglasses and a blue shirt with a white undershirt
2860400846_2c1026a573.jpg,0,a tan and white dog jumping after a red Frisbee
2860667542_95abec3380.jpg,0,A big white bird flies out of the water leaving a splash
2861413434_f0e2a10179.jpg,0,A boy wearing a blue jacket swings a bat at a white ball
2865376471_43c5e6b941.jpg,0,A brown dog is sniffing a white dog in front of 2 women
2866686547_0a67eb899d.jpg,0,Two girls are playing soccer with orange and white uniforms
2867699650_e6ddb540de.jpg,0,"A large , white dog , with a fluffy tail is running on grass"
2867845624_22e4fe0a23.jpg,0,A black and white dog frolicks in the water
2872197070_4e97c3ccfa.jpg,0,A white dog is leaping into a swimming pool
2872963574_52ab5182cb.jpg,0,A hockey player in black and white collides with another player wearing blue
2874984466_1aafec2c9f.jpg,0,A black and white dog is playing with a sheep in a field
2877503811_4e311253ec.jpg,0,A group of people are gathered on a white pillared porch for a photo
2880051254_e0ca96b6be.jpg,0,A black and white dog runs towards the camera
2880874989_a33b632924.jpg,0,a child in a black shirt reaches for a white kitchen stove
2882743431_c3e6cd1b5c.jpg,0,A black dog bites a white dog on the grass
2884092603_786b53a74b.jpg,0,A girl in a white shirt poses and smiles as someone holds up a peace sign behind her
2885891981_6b02620ae9.jpg,0,A boy in a blue shirt and white helmet is riding a white bike
2886411666_72d8b12ce4.jpg,0,"a black , brown and white dog is running beside a green fence in a grassy garden"
2890113532_ab2003d74e.jpg,0,A brown dog and a black and white dog are running over grassy hills
2892992529_f3335d0a71.jpg,0,A black and white dog with a Frisbee in his mouth on his hind legs
2894217628_f1a4153dca.jpg,0,"A holder and kicker for a football team dressed in orange , white and black play while onlookers behind them watch"
2894229082_ddc395f138.jpg,0,A child with a pink hat and a white and pink shirt standing in grass
2896483502_6f807bae9e.jpg,0,a black and white dog is catching a Frisbee
2896668718_0c3cff910f.jpg,0,One football player wearing an orange jersey and one wearing a white jersey are set at the starting line
289860281_94d699f36d.jpg,0,"A girl in a bikini , glasses and black hat laying on a white towel on the beach"
290019324_23582048d4.jpg,0,A black and white dog with a spotted face is running through a dirt field
2901880865_3fd7b66a45.jpg,0,a lone surfboarder on a white surfboard flying through the air over a wave
2904601886_39e9d317b1.jpg,0,"prarie dogs that are spotted with , brown black and white"
2905975229_7c37156dbe.jpg,0,Airplane controller is outside white airplane
290650302_ade636da35.jpg,0,"A woman , in red and white , and wearing glasses , sits in a room with other people"
2912476706_9a0dbd3a67.jpg,0,A brown and white dog bares his teeth and grabs the head of another brown and white dog
2913818905_8e4d9aa82a.jpg,0,A black dog and a black and white dog are running in dirt
291952021_f111b0fb3d.jpg,0,A brown and white dog carries a brown and white dish towel in his mouth
2923497185_c64004ff2d.jpg,0,a brown and white dog is running through a white marker in a grassy field
292887910_f34ac101c8.jpg,0,A white dog with brown markings chases an orange ball in a grassy field
2929669711_b2d5a640f0.jpg,0,A man in blue and black surfs on a huge white wave
2933643390_1c6086684b.jpg,0,football players wearing orange uniforms are tackling a player in a white uniform
2935703360_4f794f7f09.jpg,0,A black and white dog is running between yellow poles
2937461473_11bbace28c.jpg,0,A bunch of children in white are doing a dance routine while another person jumps rope
2937942758_712be5c610.jpg,0,A person is standing near a row of identical red and white bicycles
2942133798_e57c862a90.jpg,0,A brown and white dog is running with a yellow Frisbee
2943384009_c8cf749181.jpg,0,A black and white motorcycle is being ridden around a racetrack
294353408_d459bdaa68.jpg,0,A brown and white dog is jumping on the couch next to someone with blue slippers
2944952557_8484f0da8f.jpg,0,A girl in a blue and white uniform tags someone in a black and red uniform
294549892_babb130543.jpg,0,2 People with white hats looking over the mountain
294709836_87126898fb.jpg,0,A closeup of a white bunny
2949353587_64c54e9589.jpg,0,A brown dog is chewing on a white rug whilst standing on a red carpet next to a checkered floor
2955673642_4279b32097.jpg,0,A car with white smoke trailing behind it on a black topped surface
2962977152_9d6958fdd5.jpg,0,A man in a white shirt and blue shorts and a man in a red shirt and white shorts playing soccer
2964438493_413667c04a.jpg,0,A tan dog plays with a white dog in a baby pool
2967549094_d32422eb01.jpg,0,a man inside of a white subway train
2968135512_51fbb56e3e.jpg,0,A boy in a white t-shirt does skateboard tricks
2976537455_f3988c2d46.jpg,0,A hockey player in red untangles from a player in white as he goes for the puck
2978024878_a45b282bf4.jpg,0,Muzzled white dogs running
2987121689_f9de6c479b.jpg,0,A man in a white sports uniform tries to fend off another player in a black and yellow uniform while the ball floats in midair
2994104606_bc2df6c1f4.jpg,0,A white ad brown dog is running on grass
2998504949_1022fec53b.jpg,0,A man in a blue coat walks a small white animal as a buss passes in the background
3000722396_1ae2e976c2.jpg,0,A black and white dog carries a ball toy
300148649_72f7f0399c.jpg,0,A man in a white shirt and jeans playing an accordion
300274198_eefd8e057e.jpg,0,A brown and white dog licking its chops while sitting in a green room with a tile floor
3003612178_8230d65833.jpg,0,A smiling woman with red lips wearing a white sweater and black hat is waving
3004823335_9b82cbd8a7.jpg,0,A black and white dog looking up
300765528_8c8f709dda.jpg,0,A group of brides in white gowns hold red flowers on the side of a street
3014546644_d53db746ec.jpg,0,A black and white dog on an orange leash jumps in a field
3016726158_4d15b83b06.jpg,0,The man wears a white hat and poses with a blonde woman and a black haired woman
3018304737_0a46fc5f1d.jpg,0,a lone surfboarder surfing a wave riding a white surfboard
3018847610_0bf4d7e43d.jpg,0,A man is jumping on another man with a white face and long hair in a wrestling Ring
3019473225_8e59b8ec4e.jpg,0,A black and white dog in the grass holding a pine cone in its mouth
3025334206_76888792e5.jpg,0,one large brown dog running alongside a black and white dog
3028561714_83fb921067.jpg,0,A white and brown dog is leaping through the air
3029715635_43ab414dfb.jpg,0,A black and white dog with a blue toy in its mouth runs on a grassy surface just beyond a fence
3032790880_d216197d55.jpg,0,A soccer player in a red and white uniform was chasing the soccer ball and was tripped by a player in a purple uniform
3033210806_3ffc0a231a.jpg,0,An older lady dressed in winter clothes looks out over a white balcony
3033668641_5905f73990.jpg,0,A man in a white helmet clings to a sheer rock face
3036033157_522a43a550.jpg,0,A black and white dog is carrying a blue ball through the yard of a house in a tropical location
303607405_f36edf16c6.jpg,0,A brown white dog shaking water off
3041348852_872c027c16.jpg,0,Five small white dogs are wearing muzzles and running
3041645937_ff7591d134.jpg,0,A man in a brown jacket and a white shirt looks to his side
3042405316_ba3a01926b.jpg,0,A girl in a blue sweater with a white pattern is jumping into a pile of leaves
3043266735_904dda6ded.jpg,0,An elderly person with a white hat is reading a paperback book
3044359043_627488ddf0.jpg,0,A black and white dog with a green collar stands in front of a sign
3046259614_614394e024.jpg,0,A man dressed in all white is talking to the people seated on the dirt floor
3048211972_db71d104c2.jpg,0,A brown and white dog walking on concrete debris with a gravel pile in the background
3064716525_b8418d4946.jpg,0,a black and white dog is jumping fences in a dog show
3067971348_69af5bb309.jpg,0,A cyclist is riding along a white line in a busy city center
3068945309_ff0973e859.jpg,0,A basketball player in a white uniform is making a jump shot against a team wearing black uniforms
3069037969_bb7319e0dc.jpg,0,A black and white dog jumps in a pool filled with tennis balls
3072172967_630e9c69d0.jpg,0,A player from the white and green highschool team dribbles down court defended by a player from the other team
3076052114_233f42ae5b.jpg,0,"Two black , brown and white dogs run along the countryside with white sheep in the background"
3080056515_3013830309.jpg,0,A boy is whispering to a girl wearing a red and white hat and scarf
3081734118_6f2090215c.jpg,0,a brown and white dog has is mouth open ready to catch a green ball
3082196097_2d15455b00.jpg,0,A man in a white shirt and tie sings into a microphone while a woman wearing a white shirt and tie plays the guitar at a concert
3082934678_58534e9d2c.jpg,0,A tan dog is running on pavement with a white dog running on grass beside it
3084731832_8e518e320d.jpg,0,a dog stands in the white snow
3085667865_fa001816be.jpg,0,a lone surfboarder jumping a wave on a white surfboard
3086523890_fd9394af8b.jpg,0,A big brown dog plays with a small white dog near a ball
3091382602_60b9b53ed1.jpg,0,A man in a white shirt and a man in a black shirt in a hallway
3103185190_eb8729c166.jpg,0,A girl in a white shirt and jeans is jumping up in the air while at the top of the Grand Canyon
3105623068_392b767a7b.jpg,0,A girl in white is rock climbing
3108378861_d2214d971e.jpg,0,"A man and woman , both wearing white , are on rocks"
3108544687_c7115823f5.jpg,0,a couple each wearing white tanktops sitting on a rock ledge of looking several mountains
3108732084_565b423162.jpg,0,A man in a white coat jumps a snowboard
3109780402_dbae082dc5.jpg,0,a girl in colorful leggings and a white shirt sits next to similarly dressed girl in a small cubicle
3112635165_2d614d7c1a.jpg,0,A black and white dog holds a stick in his paw for chewing or playing
311267421_e204e643cf.jpg,0,A black and white and a brown and white dog running in a grassy field in front of a stand of trees
3114944484_28b5bb9842.jpg,0,a girl in a red shirt looks at her mom in a crowd of people sitting in white plastic chairs
3123463486_f5b36a3624.jpg,0,"A brown , black , and white dog runs along on the gravel"
3128856481_86e5df4160.jpg,0,A white duck expanding its wings in the water
313051099_1bb87d6c56.jpg,0,A closeup of a white dog 's face while he is holding a stick in his mouth
3132619510_7dfc947d25.jpg,0,A white dog with brown ears leaps at a white dog running from it
3135504530_0f4130d8f8.jpg,0,One girl is wearing a white t-shirt with red sleeves ; the other has words on hers
3138562460_44227a35cf.jpg,0,A brown and white horse runs in the gravel
3139895886_5a6d495b13.jpg,0,"A black-and-white dog bounds off the ground , all feet in the air , of a yellow field"
3143765063_a7761b16d3.jpg,0,A man in an elf hat holding a white umbrella is standing on the sidewalk with two other men
3146232740_df3da0163b.jpg,0,A black-and-white dog carries a stick in his mouth as he swims in the clear water
3146630574_05d9ebbed1.jpg,0,A black and white dog is running through the water while holding something red in its mouth
314904143_5a216a192b.jpg,0,"A man with rock climbing equipment is hanging from a vertical , white rock"
315125146_d9a8e60061.jpg,0,A black and white dog bits the jacket of a person
3151365121_e2a685a666.jpg,0,A black and white dog walks along a sandy beach
3155987659_b9ea318dd3.jpg,0,A black and white dog is catching a Frisbee in the yard
315880837_90db309bab.jpg,0,Three dogs are playing in the white snow
3161044966_27bf6f9dec.jpg,0,A brown and white dog jumps onto a beige leather chair
3162045919_c2decbb69b.jpg,0,A lone surfer on a white surfboard atop a huge wave in the ocean
3163563871_cef3cf33ea.jpg,0,A boy in a white shirt and blue shirts is playing tennis
316577571_27a0e0253e.jpg,0,A white dog and a black and white dog are running through the grass
317109978_cb557802e1.jpg,0,"A brown and white pitbull , with a black collar , is about to leap over a branch"
3171347658_f0d5469c56.jpg,0,A driver with a white helmet is sitting in a yellow race car
3173157541_70b16b4318.jpg,0,A man in a white hat is standing behind a woman with a red shawl over her head
3173976185_8a50123050.jpg,0,a black and white dog is standing on the grass with its mouth wide open
3174228611_6cf9d2266b.jpg,0,a basketball player wearing a red and white jersey while running down the court
3178599352_c57fdebcd2.jpg,0,A girl in jeans sitting on a white couch and smiling
3185695861_86152b2755.jpg,0,A black and white dog catching a tennis ball in his mouth
3187117682_986ffd6b67.jpg,0,A brown and white dog with a black collar and gold tag licking the snow from its nose
3187395715_f2940c2b72.jpg,0,a boy on skateboard is making a jump from a blue bench beside a white wall
3187924573_203223e6c0.jpg,0,A large white bird pulling a fish out of the water
3188319076_71724fcc07.jpg,0,A black and white dog jumps up and down in the snow
3189251454_03b76c2e92.jpg,0,A brown dog barks surrounded by white snow
3190677999_60bbd330fd.jpg,0,One child in black is walking down a hill covered in white snow while 2 children are on their knees
3197891333_b1b0fd1702.jpg,0,"A family of nine people , including four children , pose in front of a brick fireplace with a white mantle"
3201594926_cd2009eb13.jpg,0,A girl wearing white polka dots and black boots walks and a woman in a blue outfit hurridly walks behind her
3204525212_d548c7fca7.jpg,0,A black dog and small white and black dog look up at a kitchen countertop
3206999917_e682672cbc.jpg,0,"A black , brown and white dog with his tongue out is in the snow"
3209523192_05a4cef844.jpg,0,A main in a black and white shirt is skiing with red flags to the right
3211199368_ca78387f72.jpg,0,"a brown and white dog standing on the street wearing a hat , shirt and jeans"
3211577298_14296db6fd.jpg,0,A man is surfing a big wave on a white surfboard
3217620013_8b17873273.jpg,0,A basketball player in a red uniform is holding the ball while a player in a white uniform is trying to block him
3218481970_1fa627b3da.jpg,0,A basketball player in white leaps up at the net
3222055946_45f7293bb2.jpg,0,A basketball player wearing a black and white uniform dribbles the ball
3222842866_cb85243ce4.jpg,0,A black and white spotted dog runs along the seaweed and sand
3224227640_31865b3651.jpg,0,A big brown dog chases a smaller white dog around in the grass
3234115903_f4dfc8fc75.jpg,0,A female hockey player in blue is challenging the player in white for the ball
3234719720_5bb2fc5ffa.jpg,0,A dark haired bearded man in a white dress shirt and black sweater and a woman in a black and white dress in a small space
323657582_b6b6d8f7bd.jpg,0,A black and white dog carries a huge stick on the green grass
3239480519_22540b5016.jpg,0,A black and white dog returns a stick in the snow
3243020805_2bafc36c45.jpg,0,A boy is wielding a long white stick whilst some people are watching him from behind
3244734844_c318c29c23.jpg,0,"A boy wearing a blue parka , green pants , and white shoes is leaping in a ramp"
3247423890_163f00a2cb.jpg,0,A man in a grey shirt juggles six black and white balls
3247598959_5b2348444c.jpg,0,"A brown , black , and white dog play in a grassy field"
3248408149_41a8dd90d3.jpg,0,A brown and white dog standing next to a smaller brown and white dog in front of a fence
3255017708_2b02bfcdcf.jpg,0,A man in American flag shorts holds a white cube at the entrance of a marble building
3256043809_47258e0b3e.jpg,0,a brown and white dog is sniffing the snow covered ground
3257277774_aba333a94c.jpg,0,A black and white dog jumping in the snow
3258395783_2de3a4ba27.jpg,0,A camera team wearing jackets stands in front of a white building
3258396041_69717247f7.jpg,0,a male reported in a black and white jacket interviewing a young woman
3259757648_71edb4347b.jpg,0,A dog is jumping over a blue and white obstacle course fence
3261666285_86fceb762d.jpg,0,A basketball player in white is trying to defend against the player in black who is dribbling the ball
3262849619_0bc4f88ef9.jpg,0,A black and white dog biting onto a chunk of ice
3265209567_b3b9c8e0fe.jpg,0,A brown and white dog walks behind a brown cow
3265527323_6431f00692.jpg,0,A chicken and a white dog in the mulch
3265578645_4044a7049a.jpg,0,A person stands in front of a white and red bus
3273625566_2454f1556b.jpg,0,A black greyhound in white and green coming up on the rear of a white greyhound in yellow and black in a race
3273969811_42e9fa8f63.jpg,0,A large white bird flies out of the water
3276895962_c053263d01.jpg,0,A black dog and a brown-and-white dog play in a field
3278189732_f750cb26b7.jpg,0,A black and white dog jumping high to catch a ball
3279524184_d5e2ffbaed.jpg,0,Two black and white dogs and one has something blue in its mouth
3285180819_a9712fd2bc.jpg,0,A basketball player in blue is attempting to block a player in white during a game
3286406057_a1668655af.jpg,0,"Two Asian women in red bottoms , one in a blue top , one in a white top , leaning down over something while the woman in the blue top smiles"
3289893683_d4cc3ce208.jpg,0,The basketball player in red is challenging the player in white for the ball
3290105461_7590f23371.jpg,0,"A cricket batter , dressed all in white , makes a hit"
3294209955_a1f1e2cc19.jpg,0,A little white and brown dog runs through brown grass
3295452057_0c987f895f.jpg,0,A brown dog is jumping up at a black and white dog
3295671644_0e10891b6d.jpg,0,A black and white dog looking at the camera
3296715418_29542dcdc2.jpg,0,A beautiful white dog walking in the brown grass
3298175192_bbef524ddc.jpg,0,A black and white dog is chewing on a camera
3301438465_10121a2412.jpg,0,People in white standing on sports field while crowd watches from stands
3301935788_2bb7bbc515.jpg,0,"A person in a white coat and pink pants snowboards at the "" snow park """
3307077951_dd31f1971c.jpg,0,A black and white dog is running over grass
3313232606_4ce7e16b87.jpg,0,A group of men in white shirts and dark shorts are running on an athletic field
3314517351_69d70e62bd.jpg,0,A barechested man surfs on a white surfboard
3315110972_1090d11728.jpg,0,A large white bird flying over water
3317145805_071b15debb.jpg,0,"A black dog with a red and white rope dog toy in its mouth , standing in front of a building"
3318564834_4ccea90497.jpg,0,"A boy pauses in drawing on a white balloon to smile at the camera , and the girl next to him also smiles at the camera"
332045444_583acaefc3.jpg,0,A little white curly haired dog runs across the pavement with a stick in its mouth
3321334180_8f764e0e0f.jpg,0,A beautiful white bird takes off in flight
3323514651_3efdbd63ed.jpg,0,"A basketball player in black jumps , while another in white attempts to block"
3326588088_172d1b2584.jpg,0,Two guitarists dressed in white perform
3327563443_870a33f748.jpg,0,"A woman in a white baseball hat reveals her tan line to her friend , who wears a sun hat"
3329169877_175cb16845.jpg,0,A lone snowboarder wearing a white jacket jumping into the air on the snowy mountains
333031366_a0828c540d.jpg,0,A black and white dog with a stick is in muddy water
3331190056_09f4ca9fd2.jpg,0,One white boy and one black boy stand with arms around each other
3332202255_a30c522664.jpg,0,A man with a white guitar plays with another in a striped shirt
3332467180_d72f9b067d.jpg,0,A man in a white restaraunt shirt smokes next to a dumpster
3333675897_0043f992d3.jpg,0,A black and white dog is performing tricks on a course
3339105374_cc41e0b7d7.jpg,0,A woman in a red coat with a man in a white and black coat and a black dog in the snow
3339768802_8ab768558a.jpg,0,A child in a tie dye shirt and one in a white shirt are on a climbing wall
3340857141_85d97a7466.jpg,0,A brown dog is lowering his head near a smaller white dog outdoors
3341782693_426bf7139b.jpg,0,A man wearing a gray swimsuit stands in the water amidst white waves
3342822192_082f932ef2.jpg,0,A goalie blocks the puck while holding a white hockey stick
3344531479_03c69750e9.jpg,0,A man in a orange shirt and white shorts playing tennis
3346711367_5e7b29e20f.jpg,0,A black dog is chasing a tan and white dog on a sunny day
3348384389_73b6647017.jpg,0,A brown and white dog with a pink collar is barking at a brown dog with a blue collar in the snow
3349968447_b5d4a477b2.jpg,0,A white dog carries a bottle in its mouth through the snow
3351360323_91bb341350.jpg,0,Two bandmates in white play guitar
3354063643_1d8814eb13.jpg,0,A brown and white dog bares his teeth in the snow
3355683198_715fb1a2ac.jpg,0,A boy in a blue and white tie dye t-shirt is skateboarding on the railing of a building
3356642567_f1d92cb81b.jpg,0,A girl in a white and pink sweater is looking up through tree branches
3357937209_cf4a9512ac.jpg,0,A black sheep with three white dogs
3358380484_b99b48f0c9.jpg,0,A brown and white dog is running
