id_imagen,id_seqq,descr
3360994630_d4616c1b14.jpg,0,A black and white bird getting ready to land on the water
3361411074_83f27d2a1c.jpg,0,A brown and white dog is running up a grassy hill
3363750526_efcedc47a9.jpg,0,A black and white dog is running on the beach
3366105287_49a4bf71c6.jpg,0,a boy in a purple shirt is doing a skateboard stunt on a wooden ramp beside a white building
3368671163_0171259581.jpg,0,A beige dog runs behind a white dog holding a yellow toy
3370085095_6abbb67c1d.jpg,0,"A man with a white beard , a partially bald man and a woman with short hair posing for a picture"
3375070563_3c290a7991.jpg,0,A large grey and white water bird
3383388869_a14552e551.jpg,0,a brown and white dog swimming in water
3387542157_81bfd00072.jpg,0,"A dark-haired young woman , number 528 , wearing red and white , is preparing to throw a shot put"
3391209042_d2de8a8978.jpg,0,"Two figures stand in a snowy setting wearing white and hot pink outfits , gazing towards a mountain"
3396043950_12783c5147.jpg,0,A boy wearing a white apron has is arms out in a communal darts and craft room whilst a boy in blue looks on
3396157719_6807d52a81.jpg,0,A brown and white dog on a trampoline with a forest in the background
3396817186_b299ee0531.jpg,0,A brown and white dog has caught a yellow ball in a grassy field surrounded by trees
3397228832_8ce5b1c26f.jpg,0,A man in white shorts and a wet-suit top is riding on a bright yellow surfboard
3400082864_9c737c1450.jpg,0,A man in a blue headband and white shirt plays tennis
3400135828_0ac128b6eb.jpg,0,a black and white dog jumping through the snow
3401902253_cd27e6d0fe.jpg,0,A black and white dog leaping out of the water
3407317539_68765a3375.jpg,0,A black and white dog is running across a snow covered field
3409326324_a704565e8f.jpg,0,a group on white and balck birds lined up on a concrete wall
3412036192_d8cd12ed3f.jpg,0,A brown and white dog is jumping up to catch a ball in the park
341430859_4519802e8f.jpg,0,A brown and white dog stands in the deep snow
3415165462_e1cb536d08.jpg,0,A brown and white dog is jumping in the air with a tennis ball in its mouth
3415589320_71a5bf64cf.jpg,0,A brown and white dog wrestles with a gray dog
3416339125_0860d3d1eb.jpg,0,A man in a white shirt and sunglasses and a man in a black shirt and sunglasses sit at a table with four beer bottles
3417143124_6feb8290cc.jpg,0,A lady in a plaid dress strokes her white dog 's face
3418504074_083f0bb68d.jpg,0,A black-and-white dog goes for a flattened ball on the snow
3425685827_03683e8e5a.jpg,0,A group of people sitting in a grassy area under a pink and white blossoming tree
3433982387_3fa993cf5a.jpg,0,A girl in a white dress is playing with bubbles while a mother and daughter stand to the side
3437693401_202afef348.jpg,0,A white dog and a brown dog playing violently
3437781040_82b06facb3.jpg,0,An ice hockey player in red is challenging the player in white for the puck
3439128755_84409b8823.jpg,0,A brown dog in a pink shirt chews something white while a brown dog in yellow watches
3439243433_d5f3508612.jpg,0,A long haired white dog is in an area covered with fallen brown leaves
3439982121_0afc6d5973.jpg,0,An elderly person holds a white doge and kisses their cheek
3441104823_33cdae5a56.jpg,0,a crowd of people are at the top of steps in front of a white building
3442978981_53bf1f45f3.jpg,0,Two fencers are in a bout in a white gym
3443030942_f409586258.jpg,0,"A person in a white , black and red coat is skiing down a slope"
3443351431_7b4061df5c.jpg,0,A bee hovering over white flowers
3443853670_6c79fcfcb2.jpg,0,A man with his dog sitting against a white building in the grass
344841963_8b0fa9784c.jpg,0,"A woman wearing black , a woman wearing white and a man wearing a grey suit sit on a green bench in front of Dupar 's restaurant"
3449846784_278bc1ba92.jpg,0,A black and white dog catching a baseball in midair
3454315016_f1e30d4676.jpg,0,"A large , white bird skates across the top of some water"
3455920874_6fbec43194.jpg,0,A black and white dog in midair over a hurdle
345684566_235e8dfcc1.jpg,0,A brown and white dog is walking on a woodland path
3457210101_3533edebc8.jpg,0,A woman from CBS talking to a man in a white shirt
3458559770_12cf9f134e.jpg,0,"A biker with a blue jacket , black pants , and white helmet driving on dirt while people watch"
3461041826_0e24cdf597.jpg,0,A black and white dog is playing in a pond or creek
3462165890_c13ce13eff.jpg,0,A girl with a white backpack is standing and smaller children are sitting in a row on the ground
3463268965_f22884fc69.jpg,0,A man in camo pants and a blue and white shirt running on a concrete surface with other men dressed the same running behind him
3465396606_5ba1574128.jpg,0,A blonde woman wearing a white top and black bottoms pushes a black stroller while a brunette male wearing a gray t-shirt and white shorts walks a brown dog
3470303255_fbb41b8dd0.jpg,0,A little girl in a pink hat sniffing a white flower
3471117376_40585c3fd1.jpg,0,A child in white and pink is picking a white flowered tree next to a fence
3471571540_b4ab77f20d.jpg,0,A black and white dog emerges from a yellow tunnel being coached by a man in a blue shirt at a dog show
3472485022_5d03e9852d.jpg,0,A brown and white pitbull runs through the grass with a stick in its mouth
3480051754_18e5802558.jpg,0,A crowd of dark skinned people standing outside of white tents
3480126681_52cea26bda.jpg,0,A black and white dog is running on sand
3482974845_db4f16befa.jpg,0,A black dog with his pink tongue sticking out running on the beach with a white dog wearing a red collar
3484019369_354e0b88c0.jpg,0,A hockey team in red and white on the side of the ice rink
3484365373_98d5304935.jpg,0,A girl in a blue and white uniform is jumping over a hurdle
3484841598_e26ee96aab.jpg,0,"A catcher in a black uniform on the ground with his glove upraised during a baseball game , while a man UN a white uniform keeps a foot on the base"
3485599424_94de8ede51.jpg,0,A brown and white dog plays in the yard by a house
3485816074_363cab4bff.jpg,0,A man in white and red tries to stop a man with a ball
3488087117_2719647989.jpg,0,a brown and white dog jumps on the sidewalk
3494105596_f05cb0d56f.jpg,0,a young man wearing a white shirt and red shorts kicking a ball
3498997518_c2b16f0a0e.jpg,0,A football player in blue grabs a football player in white for a tackle
3500115252_9404c066a8.jpg,0,A black dog is playing with a blue doll on a white carpet
3502343542_f9b46688e5.jpg,0,a woman wearing a white helmeted looking up as she is calming a huge rock wall
3502563726_30d1ce29c8.jpg,0,A white dog is leaning against a golden colored dog
3503011427_a4ee547c77.jpg,0,A man in a long sleeved white shirt is walking past something called the lounge bar
3503689049_63212220be.jpg,0,An african american in sunglasses and a white tee-shirt smiles
3510219078_670b6b3157.jpg,0,A black dog and a brown and white dog running and playing
3510695264_ef460fa6cc.jpg,0,A group of men in white hard hats inside an industrial building with one shooting a picture
3513362553_5fc5779e20.jpg,0,A baseball player in white swings for the ball as the player in brown is waiting to intercept
3514019869_7de4ece2a5.jpg,0,a black and brown dog jumping over two white and purple stiped poles
3514278386_de2343577e.jpg,0,A baseball player in a black shirt just tagged a player in a white shirt
3515904775_f8acc5909e.jpg,0,A black and white dog carrying an orange ball coming out of the water
3516312179_f520469038.jpg,0,a baseball player in a red shirt and white pants is swinging the bat towards a yellow ball whilst three people look on
351876121_c7c0221928.jpg,0,"A big , brown dog is sleeping next to a small black and white cat"
3523559027_a65619a34b.jpg,0,"A formation on a big field with people wearing red , white and blue"
3523874798_9ba2fa46e3.jpg,0,a boy in a white shirt and green helmet is riding a skateboard down some steps
3525403875_7f95e0cbfe.jpg,0,one white dog is running with a tennis ball in his mouth while another dog jogs along
3529314899_b4e533bb76.jpg,0,A hockey player in white tries to steal the puck from another player in red
3530087422_7eb2b2c289.jpg,0,A person in a red and white suit kneels down on his skateboard and rides down a road
3533451027_b078e4631b.jpg,0,A man in black and white is holding a ball with a red and blue stripe
3534046564_4f8546e364.jpg,0,two black and white dogs running towards each other in the grass
3534668485_6887629ff0.jpg,0,A woman in white and woman in black are standing by each other talking on cellphones
3535284878_f90f10236e.jpg,0,A white dog running on a rocky beach
3535304540_0247e8cf8c.jpg,0,A red airplane is leaving white smoke behind it
3537520829_aab733e16c.jpg,0,A person in a white shirt grinding a skateboard down a long rail in a skate park
3540241710_a4f49cde52.jpg,0,A man in a white shirt is airborne
3544669026_1b5c0e6316.jpg,0,A black dog jumps up to catch a white ball
3544673666_ffc7483c96.jpg,0,A brown dog leaps in the air to catch a white volleyball
3544793763_b38546a5e8.jpg,0,A boxer in black trunks taking a swing at a boxer in white trunks
3544803461_a418ca611e.jpg,0,A black man in white shorts and a white man in black shorts boxing
3549408779_4d453db080.jpg,0,A black and white dog is swimming in some water
3552435734_04da83b905.jpg,0,A black and white dog running through shallow water
3556390715_65c6d1e88b.jpg,0,A brown and white dog with a brown and black bandanna running very fast
3560771491_2a18b6241e.jpg,0,A dirty-blonde girl wearing a white tank top and blue jeans is standing in the middle of a green field and playing with dandelions
3562282690_cd2a95fe9e.jpg,0,A black and white dog running on the beach while a man stands behind it
3563924606_5914392cd8.jpg,0,Two brown and white puppies are playing tug of war with a blue strip of fabric
3568219100_dfbffddccd.jpg,0,a climber in a red shirt is scaling a rock face whilst being watched by another man in a white shirt
3569329986_1f468729b2.jpg,0,A cheerful small girl dressed in a white dress with flowers runs on a grassy area with her arms in motion
3569667295_6e51db08ef.jpg,0,A black and white dog is running and splashing in water
3576536763_3c8c4f232e.jpg,0,A girl dressed in a pink sweatshirt and pink and white striped skirt plays in the waves at the beach
3578068665_87bdacef6a.jpg,0,A white car and a yellow car race down the track
3582742297_1daa29968e.jpg,0,A black dog and two brown and white dogs are romping in the mud
3582914739_bef2828a06.jpg,0,A skater woman in a white shirt is skating along a track while others watch
3583293892_c96af8cd98.jpg,0,A baseball pitcher in a red and white uniform throws the ball while his teammate watches
3583516290_1c87a13770.jpg,0,A crowd scene with people in yellow and white native clothing
3584829998_25e59fdef3.jpg,0,A white dog and a black and white dog are playing while two more black dogs move towards them
3585123310_9a8e94bd2b.jpg,0,The white puppies are playing on a couch with a baby bottle
3585488964_1467945775.jpg,0,A brown dog running with two white and brown dogs on the seashore with crashing waves behind them
3590294974_4ef98f013e.jpg,0,A man in a white tank hits a jump with his red BMX bicycle
3591461782_687e320042.jpg,0,A cowboy in a white outfit just got bucked off an angry bull
3592992234_6d3fe58a70.jpg,0,A man in a white shirt swinging a stick
3593392955_a4125087f6.jpg,0,A black and tan dog is running with a white and gray dog along dirt
3597921737_3fd1d0665b.jpg,0,The girl has a white shirt and a purple item in her hand
3597924257_d0da3c5fe6.jpg,0,A brown and white dog runs in a field of yellow flowers
3599124739_b7e60cf477.jpg,0,The two girls are in the water and one has a white shirt on
3601508034_5a3bfc905e.jpg,0,A man dressed in a yellow sports uniform and another man dressed in a red and white sports uniform holding sticks with a ball floating between them
360723732_23199af4bf.jpg,0,A black and white dog has a red toy in his mouth and is jumping
3608567609_aae96d4a5e.jpg,0,The girl with red sunglasses and a white shirt is sitting on a bench next to the girl in the black tank top
3612485097_b706d950ed.jpg,0,A black man leans over as a white man jumps on his back backwards
3613264553_97b687f172.jpg,0,A white dog is on a large rocky surface at a high elevation
3613800013_5a54968ab0.jpg,0,A brown and white dog is running with its mouth open accross a field
3618504267_d7eaa495d0.jpg,0,A guy and white dog standing on grass
3618932839_acd7d2c2ea.jpg,0,A black and white dog jumping over a hurdle
3619416477_9d18580a14.jpg,0,A white dog catches a green ball while standing in shallow water
3619630328_2d0865b6f4.jpg,0,"a brown and white dog jumping over a red , yellow and white pole"
3623331945_df0f51d7dd.jpg,0,A boy wearing a white hat is running on the beach
3625957413_e475943aa3.jpg,0,A black and white dog is running along side a small brown or white dog in the grass
3626475209_f71cdd06bd.jpg,0,A black and white dog jumping over an obstacle
3628043835_9d9bd595a7.jpg,0,A man dressed in white runs away from two men chasing him dressed in black
3630991662_990f397f7c.jpg,0,A woman in a black shirt and white headband stretches in the sunset
3635194562_4c1dfa120a.jpg,0,A child dressed in a white coat paints an image on the paper laying on the table
3638992163_a085cc0c24.jpg,0,A brown and white dog is jumping through a red hoop
3639684919_cb6fbf5638.jpg,0,A bride in a white dress is holding a purple bouquet whilst standing next to her groom
3643087589_627a0a9e01.jpg,0,A large yellow dog and a small white dog in the grass
3646820231_2abc736840.jpg,0,A black and brown dog pokes his head above the white farm animals
3647750811_395fbd397e.jpg,0,a black and white dog is wearing a red collar whilst walking on the grass
3649387275_75295baa28.jpg,0,A white and brown dog appears to be walking on the water
3652859271_908ae0ae89.jpg,0,A person wearing a red jacket holds a beer while a man in a white shirt follows
3654103642_075f8af4f4.jpg,0,A brown dog and a white dog run along an ocean shoreline
365759754_6cf7068c9a.jpg,0,A black dog carries a white toy in his mouth and walks on the snowy field
3665179773_dd217416fc.jpg,0,A blonde girl in white has her arms around a girl in a helmet
3665549027_d7fb05d157.jpg,0,A brown dog is playing with a white and brown dog in a grassy and treed area
3665569615_9a71c4b6e4.jpg,0,A baseball pitcher wearing a white and red uniform caught in midpitch of the ball
3665987581_5e6b0a65f2.jpg,0,A brown and white corgi trailing a leash chasing sheep
3666537170_c4ecda4be8.jpg,0,A boy in orange and white swimming trunks is falling into water at a beach or lake
3673165148_67f217064f.jpg,0,A brown and white dog is standing in shallow water on a beach near a large rock outcrop
3673970325_4e025069e9.jpg,0,A girl in a white shirt kneeling down lighting a candle
3679405397_bb130ea3c2.jpg,0,a man in a white t-shirt with a red logo is wearing colored beads whilst carrying a flag past a row of spectators
367964525_b1528ac6e4.jpg,0,A brown and white dog running out of the woods through snow
3681414069_71ba164f71.jpg,0,One black and white dog sleeps while the other two black and white dogs play with a plastic bag
3682277595_55f8b16975.jpg,0,A brown and white dog trots across shallow water with his mouth open
3685328542_ab999b83bb.jpg,0,A dark man in a white and green feathered mask with green jewelry and pants
3693297007_94512e861e.jpg,0,A girl in a white shirt is looking down at a bunch of people sitting on the ground
3695517194_2a6b604cb2.jpg,0,"A black soccer male soccer player in a purple uniform with a soccer ball on his head , and a white male soccer player in a white uniform behind him"
3697379772_40d831392b.jpg,0,a man playing a white guitar and singing as well
3698944019_825ef54f2f.jpg,0,A blonde toddler in a white shirt and green pants standing at a wooden fence
3702436188_2c26192fd0.jpg,0,a boy wearing a white shirt and pink shoelaces jumping on a railing
3708266246_97a033fcc7.jpg,0,A black and white dog is going through an obstacle course
3711826708_bba64fb1e1.jpg,0,A brown dog is walking on a wooded path with white flowers
3712742641_641282803e.jpg,0,A black and white dog is swimming in a lake
3713133789_f05e8daffd.jpg,0,a brown and white dog jumping over blue and white poles
3716272233_7845ec5b3e.jpg,0,A large white bird goes across the water
3718007650_e5930b4509.jpg,0,A girl with a black dress and big white bow stands with her back to the camera
3718076407_0b4588d7bc.jpg,0,A brown and white dog is playing with a toy in a field of green grass and clover
3723690961_729dd5d617.jpg,0,A man in a pink shirt and white vest plays a guitar
378170167_9b5119d918.jpg,0,A white dog is running along a path outside
381514859_b40418d9c3.jpg,0,Two small white dogs are in a yard chasing a red ball
382090166_be2c2c63e1.jpg,0,A white dog and two black dogs playing
385835044_4aa11f6990.jpg,0,A girl wearing a brown jacket and blue jeans has on some white headphones and is walking
389643437_9a9830a3ba.jpg,0,A girl in a white cap eats a slice of fruit next to a girl in a blue cap who is eating chocolate
390671130_09fdccd52f.jpg,0,A black and white dog stands on the grass with a baseball in his mouth
391106734_d374bc3080.jpg,0,A brown and white dog is standing on its hind legs reaching for a ball
391324644_d23fdf06cb.jpg,0,A guy on inline skates with a white hat is on a yellow rail
393284934_d38e1cd6fe.jpg,0,"A black and white dog , with a red cap on its head , yawning"
396763804_3b7f1e12a8.jpg,0,A black and white dog is running through the sand on a beach
397547349_1fd14b95af.jpg,0,A man walking a small white and a big white dog on leashes
398413603_166896900f.jpg,0,A small white dog jumping to catch a tennis ball
404702274_fa8b3fe378.jpg,0,A black and white dog is leaping from a snowy path
405331006_4e94e07698.jpg,0,A man in a blue cowboy hat is riding a white horse
405537503_f66ecc5073.jpg,0,A blond climber with a white shirt is scaling a stone cliff
416106657_cab2a107a5.jpg,0,A fluffy white dog runs through the woods with his ears flapping in the breeze
421316045_ae7a1eb4bc.jpg,0,a child in an orange sweater is playing with a child in blue clothes on a white couch under a red painting
421932359_edbf181f44.jpg,0,A black and white dog is running towards the viewer
423066487_07757b2b49.jpg,0,A gyro chef in a white jacket and cap looking at gyro meat
425518464_a18b87c563.jpg,0,a person wearing a white hooded sweatshirt covered with a blanket sitting on a bench reading
426920445_d07d1fd0f7.jpg,0,A black and white dog runs on soft green grass
428408242_b32faf2240.jpg,0,A brown and white dog is jumping with a red Frisbee in its mouth
431282339_0aa60dd78e.jpg,0,a black dog is jumping over a white fence whilst taking part in a dog show
432496659_f01464d9fb.jpg,0,a brown and white dog is walking through some wasteland
442220883_ff3d6e507f.jpg,0,A brown dog has a white toy in its mouth
444803340_fdcaab86f9.jpg,0,"A guy and a girl , both wearing white shirts and jeans , stand under a flowering tree"
447722389_4b51b7e13d.jpg,0,A brown and white dog is jumping high and catching a blue ball
452345346_afe1248586.jpg,0,A brown and white dog chews on a tire
453756106_711c20471a.jpg,0,"A large , brown , fluffy dog with a small white and brown dog on a dirt surface"
457875937_982588d918.jpg,0,"Two black , brown and white dogs running in green grass with ears up on heads"
458213442_12c59e61a0.jpg,0,A black and white dog is jumping over a hurdle
460781612_6815c74d37.jpg,0,A black and white dog catches a Frisbee in midair
460935487_75b2da7854.jpg,0,A black and white dog is running up a path towards some potted plants
464116251_1ac4bc91f8.jpg,0,"A black , brown , and white dog jumping over a pile of logs with trees in the background"
468310111_d9396abcbd.jpg,0,A black and white dog is running through a cow field
468911753_cc595f5da0.jpg,0,A brown and white dog runs away carrying a big stick
475980315_b8ecd50094.jpg,0,A white dog fetches a stick as he swims in a lake
477768471_d7cd618fdb.jpg,0,A black and white dog is playing with a golf ball in the sand
47871819_db55ac4699.jpg,0,A soccer player in blue is chasing after the player in black and white
478750151_e0adb5030a.jpg,0,A white dog races a brown dog in a field of grass
483039719_75181b2726.jpg,0,"A teenage boy with a white headband looking right , a crowd in the background"
485357535_b45ba5b6da.jpg,0,A boy in a black and white shirt holds a red skateboard as he stands over the Hollywood Stars
486720042_b785e7f88c.jpg,0,A black and white spotted dog is circling a gray and white dog
487487795_54705c406e.jpg,0,A black and brown dog is playing with a brown and white dog
490390951_87395fcb1c.jpg,0,a closeup of grey and white shoes on the shore near the beach water
495054019_3dee8a02f5.jpg,0,A white haired coach is coaching his team of young men while they run towards him
495116214_f1df479fb0.jpg,0,two black and white dogs on the sandy beach fighting over a long stick
496380034_d22aeeedb3.jpg,0,A black and a white dog are both going for a blue soccer ball
500446858_125702b296.jpg,0,A small white dog is running through the dirt right on the outside of a patch of grass where two people and another small black dog are playing
501320769_31eea7b7ea.jpg,0,A child in a white bathrobe is standing in a doorway
503794526_603a7954d3.jpg,0,a boy in a white t-shirt is playing on a swing that is attached to a tree
506343925_b30a235de6.jpg,0,"A brown , white , and black dog runs in the sand"
506412121_67ecc7ec05.jpg,0,A man fishes near some white waves
506738508_327efdf9c3.jpg,0,"Two men dressed in white formal clothes and sunglasses pose , while one holds a drink"
507758961_e63ca126cc.jpg,0,A child in a white and orange outfit doing push ups
509778093_21236bb64d.jpg,0,a brown and white dog chasing a ball on some grass
510531976_90bbee22a2.jpg,0,A boy in a white tracksuit is break dancing on the ground in front of a colorful wall
512031915_0dd03dcdf9.jpg,0,A black dog on a white carpet next to an orange
512101751_05a6d93e19.jpg,0,a muzzled white dog is running on the grass
532036676_e88b13e0a1.jpg,0,a boy in a white shirt and jeans in what looks like a black camper
532457586_bddfc5251d.jpg,0,A shirtless man with a brown and white dog looking at a woman in jeans and a bikini top who is relaxing on a bench
532999240_1409d073be.jpg,0,A brown and white dog plays with a ball in the dirt
533483374_86c5d4c13e.jpg,0,A brown and white dog is standing on a beach with a tennis ball beside it
534313000_4ad39c7ee0.jpg,0,a big black and white dog jumping in a body of water
535529555_583d89b7f2.jpg,0,two brown and white dogs fighting over a Frisbee
537222436_ab406234ce.jpg,0,A black haired woman in a white skirt and black boots is carrying a red bag and walking down the street
537559285_29be110134.jpg,0,A brown and white Sheltie leaping over a rail
539705321_99406e5820.jpg,0,A kid in red falls as he struggles with a kid in white to get to a soccer ball
540873795_ae62ae6f60.jpg,0,A bearded man in white clothes is sitting on a long bench
551664516_78a5131dc4.jpg,0,A woman in a black jacket and black and white skirt walks down the street
562928217_21f967a807.jpg,0,A black and a white dog are going after a tennis ball
566397227_a469e9e415.jpg,0,A child in a white shirt and brown pants is walking through an uncut field
576075451_5e0f6facb3.jpg,0,a black and white dog jumping in the air surrounded by snow
576920249_df1bdc2068.jpg,0,A child in a white shirt clapping their hands
583087629_a09334e1fb.jpg,0,A girl is skipping across the road in front of a white truck
599366440_a238e805cf.jpg,0,A black and white dog has pinned a brown dog to the ground in front of a wishing well
621000329_84f48948eb.jpg,0,A little girl smiles as she wears a white bowl on the top of her head
624058168_f1c5e87e59.jpg,0,A black and white dog jumping into the air
632608471_a70461f123.jpg,0,A group of little girls perform a recital onstage dressed in all white
634891010_9fa189effb.jpg,0,A black and white dog jumping out of the water and a brown dog shaking off
640409060_6af18fdd54.jpg,0,A little girl in a white sundress smiles and slides down a blue slide
641893280_36fd6e886a.jpg,0,a brown dog and a white dog are running across a stony hillock
670609997_5c7fdb3f0b.jpg,0,a black and white dog jumping in the air to catch a Frisbee
687513087_413d4a3a3b.jpg,0,Two black dogs are bearing their teeth beside a white couch
733752482_ee01a419e5.jpg,0,a brown and white dog is running on the grass
746787916_ceb103069f.jpg,0,A little white dog runs out of a yellow tube while a man runs along clapping
749840385_e004bf3b7c.jpg,0,A man in a white shirt is on his cellphone by the gate
751109943_2a7f8e117f.jpg,0,A girl wets her head in a white bucket
783353797_fdf91bdf4c.jpg,0,A girl is on the sidewalk looking at a white van in the street
802594049_289e3c8420.jpg,0,A black man with facial hair wears a navy hat and blue jacket in front of a white background
805682444_90ed9e1ef3.jpg,0,The two dogs are white and black and are digging in the mud
812196663_0c969970b5.jpg,0,A black boy and white boy in swimming trunks are hugging each other on a beach or lake
818340833_7b963c0ee3.jpg,0,A black and white dog is carrying a stick in a field
824923476_d85edce294.jpg,0,A black and white dog following behind some spotted geese
825918657_d92f1761f4.jpg,0,A brown and white dog with a pink Frisbee in its mouth is humping over a man 's back
843616798_5ab0ecb525.jpg,0,A black and white dog is herding a group of sheep on a dusty road
852469220_bc0fee3623.jpg,0,A black and white dog is swimming through some water
861608773_bdafd5c996.jpg,0,A black and white dog running on a green grassy field
878758390_dd2cdc42f6.jpg,0,A white dog is running on a rocky beach
895502702_5170ada2ee.jpg,0,A black and white dog is chasing a ball on an open plane
909808296_23c427022d.jpg,0,A brown and black dog on a leash is sniffed by a black and white dog
