id_imagen,id_seqq,descr
930126921_1b94605bdc.jpg,0,A man in a black shirt enjoys a snack while a woman in a white shirt looks confused
934375844_dd149fed18.jpg,0,A baby in a white top is sitting on a bed
972381743_5677b420ab.jpg,0,"A girl all in black and white , and carrying an umbrella , walks down the street , as others watch"
98377566_e4674d1ebd.jpg,0,Two brown and white dogs lift their ears and look through a fence
987907964_5a06a63609.jpg,0,one brown and white dog chasing a black and white dog through the grass
